Title,Link,Runtime (minutes),Genres,Years,Src,About
Fingerbobs,https://www.imdb.com/title/tt0823161/,15,"Animation, Family",1972,"https://m.media-amazon.com/images/M/MV5BZGM0YjAzYjAtZDFkMC00YjhlLTk4NzQtZGIwMWNlYzA0MjE5XkEyXkFqcGdeQXVyNTgwNTk5MDU@._V1_UY209_CR3,0,140,209_AL_.jpg","Charming finger puppet series with Yoffy (Jones) telling stories featuring Fingermouse, Scampi, Gulliver the Seagull, and other animal characters. "
Fingermouse,https://www.imdb.com/title/tt0825518/,15,Family,1985-,"https://m.media-amazon.com/images/M/MV5BOWFlMDNiYmYtMjNmYS00Y2MwLTg0OGItZmZiZTI5MGJmY2RkXkEyXkFqcGdeQXVyMTE2NzA0Ng@@._V1_UY209_CR60,0,140,209_AL_.jpg","Features Fingermouse learning about different musical instruments from The Music Man, as well as having adventures with other paper finger-puppets. "
Help!... It's the Hair Bear Bunch!,https://www.imdb.com/title/tt0066667/,30,,1971-1972,"https://m.media-amazon.com/images/M/MV5BNDZkZGE4OGEtYWExNC00YTUzLWIyMGItMzU5MzhlMDIwODBmXkEyXkFqcGdeQXVyNTE1NjY5Mg@@._V1_UY209_CR3,0,140,209_AL_.jpg",Animated series centering on three bears who live in a zoo. Every now and then they try to sneak out of the zoo. So the zoo keeper and his assistant try to stop them or apprehend them when ... See full summary » 
Danger Mouse,https://www.imdb.com/title/tt0081848/,25,,1981-1992,"https://m.media-amazon.com/images/M/MV5BZDQ0NjJmNWEtY2QzZS00OTgzLThmMTItZTM0MzQ0NDcwZmE4XkEyXkFqcGdeQXVyNTAyODkwOQ@@._V1_UY209_CR7,0,140,209_AL_.jpg","Danger Mouse, the greatest secret agent in the world, must follow Colonel K's orders (and try not to break Professor Squawkencluck's inventions) to foil Baron Greenback's and his henchman Stiletto's plans. "
Bananaman,https://www.imdb.com/title/tt0084980/,5,"Animation, Action, Adventure",1983-1986,"https://m.media-amazon.com/images/M/MV5BMTkxMTYzMjczN15BMl5BanBnXkFtZTcwOTIyMDcyMQ@@._V1_UY209_CR5,0,140,209_AL_.jpg","Stupid, but well-meaning and super-strong super-hero, Bananaman gets his strength from eating bananas. Before he eats a banana, Bananaman is a young boy called Eric who is keen to keep his ... See full summary » "
Inspector Gadget,https://www.imdb.com/title/tt0085033/,30,,1983-1986,"https://m.media-amazon.com/images/M/MV5BMjA5MTM3MDUtOWNhNC00OWZhLWE4ZjYtZDA3ODBhMGMyMDcyXkEyXkFqcGdeQXVyMjM5NDQzNTk@._V1_UX140_CR0,0,140,209_AL_.jpg","A bumbling bionic police inspector stumbles about on his cases, while his niece and dog secretly do the real investigative work. "
Count Duckula,https://www.imdb.com/title/tt0088500/,22,,1988-1993,"https://m.media-amazon.com/images/M/MV5BNGM2Nzg5ZjItNWI0YS00YjkzLTljZDAtYjU2MDU2YTkyNzJkXkEyXkFqcGdeQXVyNTAyODkwOQ@@._V1_UY209_CR3,0,140,209_AL_.jpg",The misadventures of a vegetarian vampire duck and his servants. 
James the Cat,https://www.imdb.com/title/tt0813723/,5,,1984-1998,"https://m.media-amazon.com/images/M/MV5BODg3Y2JmNzItNDlmNC00MDhjLWIwNTYtOGE5MjY3MmMxMGJkXkEyXkFqcGdeQXVyODk1MzE0Mzk@._V1_UY209_CR60,0,140,209_AL_.jpg","An over-privileged fat feline is forced to live in the wild, where he befriends the forest animals. "
A Charlie Brown Christmas,https://www.imdb.com/title/tt0059026/,25,,1965 TV Movie,"https://m.media-amazon.com/images/M/MV5BMzQ3M2JhNzMtNWQ2NS00N2IxLThmYTctMzkwYzJiMThiMjI4XkEyXkFqcGdeQXVyMDM2NDM2MQ@@._V1_UY209_CR0,0,140,209_AL_.jpg","Depressed at the commercialism he sees around him, Charlie Brown tries to find a deeper meaning to Christmas. "
The Trap Door,https://www.imdb.com/title/tt0395413/,5,"Animation, Adventure, Comedy",1984-1986,"https://m.media-amazon.com/images/M/MV5BZTNiZDkwOGEtMWFjMi00YzI5LWE2YjctODExNjVlYjIxYTlhXkEyXkFqcGdeQXVyNDUxNjc5NjY@._V1_UY209_CR4,0,140,209_AL_.jpg","3D plasticine animation, featuring Berk, a blue creature who lives as servant to the unseen 'Thing Upstairs' in an old dark house. Every time the trap door opens a new adventure begins for ... See full summary » "
Paddington Bear,https://www.imdb.com/title/tt0343288/,30,"Animation, Family",1976-1993,"https://m.media-amazon.com/images/M/MV5BMjE0NTE2NTc0Ml5BMl5BanBnXkFtZTYwNDI5OTc5._V1_UX140_CR0,0,140,209_AL_.jpg","The misadventures of a little Peruvian bear living in London, England. "
Captain Pugwash,https://www.imdb.com/title/tt0199193/,5,"Animation, Family",1957-1966,"https://m.media-amazon.com/images/M/MV5BODYyNzU0Nzc4Nl5BMl5BanBnXkFtZTcwNDYwMTYyMQ@@._V1_UX140_CR0,0,140,209_AL_.jpg",The adventures of Captain Pugwash and his crew aboard the pirate ship - the Black Pig. 
Jackanory,https://www.imdb.com/title/tt0177448/,15,"Family, Fantasy",1965-1996,"https://m.media-amazon.com/images/M/MV5BMjEyNTQ4NTQzOF5BMl5BanBnXkFtZTcwODEwMjAzMQ@@._V1_UY209_CR3,0,140,209_AL_.jpg","A celebrity reads a story, enhancing it in ways that will entice the most restless of children. "
Runaround,https://www.imdb.com/title/tt0320946/,,"Family, Game-Show",1975-1981,"https://m.media-amazon.com/images/M/MV5BZmFjMmUyMTUtYjgxYi00ZDgyLTljN2YtYTFiOTJkZjkyZGNkL2ltYWdlL2ltYWdlXkEyXkFqcGdeQXVyNTgwNTk5MDU@._V1_UY209_CR104,0,140,209_AL_.jpg",Children's quiz show where the kids would run to the answer then 'runaround' if they changed their minds at the last minute. 
Get Up and Go!,https://www.imdb.com/title/tt0343265/,,Family,1981-1985,"https://m.media-amazon.com/images/M/MV5BY2FiNzAwODUtZjE2Yy00M2Y3LTgyYjMtNTQ3MmY1Njk5MDg4XkEyXkFqcGdeQXVyNTgwNTk5MDU@._V1_UY209_CR69,0,140,209_AL_.jpg",Add a Plot 
Think Again,https://www.imdb.com/title/tt0490262/,,Family,1981-1985,https://m.media-amazon.com/images/S/sash/i-t32yvKixg10fG.png,Add a Plot 
Mr. Majeika,https://www.imdb.com/title/tt0292129/,,30 min,1988-,"https://m.media-amazon.com/images/M/MV5BMTUzNTYxNTQ2NV5BMl5BanBnXkFtZTcwMDUxNTMyMQ@@._V1_UX140_CR0,0,140,209_AL_.jpg",Add a Plot 
Wizbit,https://www.imdb.com/title/tt0367438/,,"Family, Fantasy",1986-1988,"https://m.media-amazon.com/images/M/MV5BZWZlM2I5ZDMtYzhlMy00ZGJlLWJhNzctYTVjY2JmYjEwMGIyXkEyXkFqcGdeQXVyMzQ3MTU4Nzg@._V1_UX140_CR0,0,140,209_AL_.jpg","A magical children's series about an alien magician called Wizbit who comes to Earth for a year and a day to learn all about our planet. Wizbit, a giant yellow magicians hat, mainly solved puzzles in the city of Puzzleopolis. "
Why Don't You Just Switch Off Your Television Set and Go and Do Something Less Boring Instead?,https://www.imdb.com/title/tt0266205/,15,Family,1973-1995,https://m.media-amazon.com/images/S/sash/i-t32yvKixg10fG.png,Add a Plot 
Tiswas,https://www.imdb.com/title/tt0071061/,110,Family,1974-1982,"https://m.media-amazon.com/images/M/MV5BY2Q2Yjg2NzAtMWFiZC00MmQ0LTkyN2QtMGIxNzk1M2YxNjc2XkEyXkFqcGdeQXVyNTgwNTk5MDU@._V1_UY209_CR3,0,140,209_AL_.jpg","Anarchic Saturday morning children's fare which starred Chris Tarrant, Sally James, John Gorman, Lenny Henry, Bob Carolgees, and Sylvester McCoy. "
Going Live!,https://www.imdb.com/title/tt0181922/,192,Family,1987-1993,"https://m.media-amazon.com/images/M/MV5BNWU2ODJjNzAtMzA3ZS00NzM5LThlNzctY2NmOWI2ZWU1ZjczXkEyXkFqcGdeQXVyMjU0MzY0MjE@._V1_UY209_CR115,0,140,209_AL_.jpg","Children's Saturday morning magazine/variety show featuring cartoons, sketches, games, music videos, special guests and features. "
Catweazle,https://www.imdb.com/title/tt0063881/,30,"Adventure, Comedy, Family",1970-1971,"https://m.media-amazon.com/images/M/MV5BMjI5NzM1Y2ItNTU5Ni00NjQwLWE3MGItNjU3ZTFjZDYxMDY3XkEyXkFqcGdeQXVyNjg1NzcwODE@._V1_UY209_CR3,0,140,209_AL_.jpg",A medieval wizard (though not a very good one) is transported to the modern age. 
Worzel Gummidge,https://www.imdb.com/title/tt0078713/,60,"Family, Comedy, Drama",1979-1981,"https://m.media-amazon.com/images/M/MV5BNThkMDkyYjUtODdmNS00NGI1LThlMjctM2Q2NWNjNjE1MDkzXkEyXkFqcGdeQXVyNjcwMzExMzU@._V1_UY209_CR8,0,140,209_AL_.jpg","Children's series about the adventures of Worzel Gummidge (Jon Pertwee), a scarecrow who comes to life. "
Super Gran,https://www.imdb.com/title/tt0134264/,60,"Comedy, Crime, Family",1985-1987,"https://m.media-amazon.com/images/M/MV5BNjgwY2JlNDMtZjc4NS00ZWJjLWEyZWQtOWQ4Y2QwNmU3M2ZiXkEyXkFqcGdeQXVyMjM2ODYwMQ@@._V1_UY209_CR4,0,140,209_AL_.jpg",The adventures of a super-powered granny who fights crime in her community. 
The Littlest Hobo,https://www.imdb.com/title/tt0078644/,,"Adventure, Drama, Family",1979-1985,"https://m.media-amazon.com/images/M/MV5BYmQ3ZjkwM2EtMDhkMi00Y2M5LTk3NzYtYWU3YjEyNWU2Y2JhXkEyXkFqcGdeQXVyNjE4OTY3NTg@._V1_UY209_CR4,0,140,209_AL_.jpg",The wandering adventures of an intelligent German shepherd dog. 
Rolf's Cartoon Club,https://www.imdb.com/title/tt0180381/,,"Animation, Comedy, Family",1988-1992,"https://m.media-amazon.com/images/M/MV5BNWZkMTBiM2EtNGFmMi00YmNlLTlkNjktZjViZmVmZDc1ZDk0XkEyXkFqcGdeQXVyMzY2ODUzMjA@._V1_UY209_CR1,0,140,209_AL_.jpg",Add a Plot 
The Smurfs,https://www.imdb.com/title/tt0081933/,30,,1981-1989,"https://m.media-amazon.com/images/M/MV5BZDE3YjY5MzEtYzJlYS00ZjgyLWIzYWUtZmU4Mjk4Y2JhOTQwXkEyXkFqcGdeQXVyNTE1NjY5Mg@@._V1_UY209_CR1,0,140,209_AL_.jpg","The Smurfs are tiny blue creatures that live in mushroom houses in a peaceful forest. They repeatedly try to outwit Gargamel, an evil sorcerer, his apprentice, Scruple, and his mangy cat, Azrael. "
Wacaday,https://www.imdb.com/title/tt0862635/,30,Family,1985-1992,https://m.media-amazon.com/images/S/sash/i-t32yvKixg10fG.png,Add a Plot 
D'Artacan y los tres mosqueperros,https://www.imdb.com/title/tt0083780/,24,"Animation, Adventure, Comedy",1981-1982,"https://m.media-amazon.com/images/M/MV5BYzViZDg3Y2ItMTZkZS00MDliLTkyNzYtZDdiZTY5ZTBkZmExXkEyXkFqcGdeQXVyNjExODE1MDc@._V1_UY209_CR2,0,140,209_AL_.jpg","In 17th century France, young Dogtanian travels to Paris to fulfill his ambition to become one of the King's Musketeers. He befriends Athos, Porthos and Aramis and falls in love with Juliette. A doggy version of the tale. "